proxy_group,representative_foreground_nodes,typical_source_activity_family,main_edits,used_in
Scrap-gate and burdens-only treatment proxies,"al_scrap_postconsumer_CA_gate, al_scrap_postconsumer_CA_gate_FSC, AL_UP_refiner_postcons_NO_CREDIT_CA",Post-consumer aluminium scrap treatment / refiner treatment,Copied treatment burdens retained; negative technosphere exchanges stripped where embedded consequential credits had to be isolated; route basis renormalized,"Conventional recycling, MS-FSC, hydrolysis"
Preparation proxies,"AL_UP_degreasing_CA, FSC_degreasing_CA, al_scrap_shredding_for_hydrolysis_CA",Metal-part degreasing and scrap preparation activities,"Electricity scaling, yield scaling, and where needed surface-area conversion or shred/prep normalization","Reuse, MS-FSC, hydrolysis"
Hydrolysis service proxies,"di_water_CA, wastewater_treatment_unpolluted_CAe, naoh_CA_proxy, naoh_electrolyte_solution_CA, h2_purification_psa_service_CA","Water production, wastewater treatment, sodium hydroxide market, biogas purification by PSA","Utility relinking, quantity scaling, electrolyte make-up construction, and gate-basis normalization",Hydrolysis
MS-FSC process proxy / explicit foreground node,FSC_consolidation_CA and scenario equivalents,Foreground-added process node informed by measured processing inputs; supported by preparation-chain proxies,"Explicit electricity, lubricant, shred-yield, and retained-yield terms; no reliance on an off-the-shelf consolidation activity",MS-FSC
Receiving-system and credit proxies,"AL_credit_primary_ingot_IAI_NA_QC_elec, AL_UP_avoided_impact_extrusion_CA, hydrogen LP market proxies, Al(OH)3 market proxies, SMR provider clone","Aluminium ingot market / primary ingot production, impact extrusion, hydrogen market, aluminium hydroxide market, hydrogen production provider","Localization, supplier forcing, electricity relinking, and/or credit isolation to create explicit avoided-burden nodes","Reuse, conventional recycling, MS-FSC, hydrolysis"
Non-priority material treatment proxies,"Per-material C3-C4 and Stage D wrappers for CLT, SPF, glass, XPS, polyethylene, polyamide, silicone, silica gel, EPDM, gypsum, and fibre glass","Waste wood incineration, waste glass landfill, waste polystyrene landfill, waste polyethylene landfill, mixed plastic landfill, MSW landfill, waste rubber incineration, waste gypsum landfill, waste mineral wool recycling","Template copy, split of positive versus negative technosphere exchanges, electricity/utility localization, scenario-specific wrapper generation where required",Non-priority material layer
